{"done":false,"done_reason":"大目标未完成：D-04（其它设置页与 legacy 同义）仍有缺口，`updateToVariant` 选择器与 Web 只读配置回显尚未落地，台账状态也未按当前代码更新。","goal_summary":"本轮建议先完成 D-04 收口：先刷新差异清单，再补齐 `updateToVariant` 交互与 Web 只读回显，最后回填证据文档并更新状态。","tasks":[{"id":"C26-T1","title":"先更新 D-04 差异清单为当前实况（迁移前置）","priority":1,"prompt":"改动范围：`docs/plans/2026-02-26-my-menu-parity-checklist.md`。预期行为：按当前代码重新标注 D-04 的 11 键状态，明确 8 个 non-Web 布尔开关已接线、`showMangaUi` 已接线、`updateToVariant` 未接线、`webPort/webServiceWakeLock` 仍为静态占位；保留 `EX-01=blocked`。验证方式：检索 D-04 小节内每个键均有“已实现/未实现”结论且与代码命中一致。","verify_cmd":"rg -n \"### D-04|cronet|antiAlias|mediaButtonOnExit|readAloudByMediaButton|ignoreAudioFocus|autoClearExpired|showAddToShelfAlert|showMangaUi|updateToVariant|webPort|webServiceWakeLock|EX-01|blocked\" docs/plans/2026-02-26-my-menu-parity-checklist.md","required_paths":["docs/plans/2026-02-26-my-menu-parity-checklist.md"],"depends_on":[]},{"id":"C26-T2","title":"在其它设置页补齐 updateToVariant 的 Cupertino 选择器","priority":2,"prompt":"改动范围：`lib/features/settings/views/other_settings_view.dart`（必要时只读复用 `lib/core/models/app_settings.dart` 既有常量/标签方法，不新增无关逻辑）。预期行为：在“非 Web 其它设置”分组新增 `updateToVariant` 条目，点击后使用 `showCupertinoModalPopup + CupertinoActionSheet` 提供 `default_version`、`beta_release_version`、`beta_releaseA_version` 三选一；确认后调用 `SettingsService.saveUpdateToVariant`，取消不修改；列表 `additionalInfo` 立即回显 `AppSettings.updateToVariantLabel(...)`。验证方式：检索 UI 条目、ActionSheet、三值常量、保存调用和标签回显同时存在。","verify_cmd":"rg -n \"updateToVariant|showCupertinoModalPopup|CupertinoActionSheet|CupertinoActionSheetAction|saveUpdateToVariant|default_version|beta_release_version|beta_releaseA_version|updateToVariantLabel\" lib/features/settings/views/other_settings_view.dart lib/core/models/app_settings.dart","required_paths":["lib/features/settings/views/other_settings_view.dart","lib/core/models/app_settings.dart"],"depends_on":["C26-T1"]},{"id":"C26-T3","title":"将 Web 服务分组改为只读配置值回显（保持 EX-01 边界）","priority":3,"prompt":"改动范围：`lib/features/settings/views/other_settings_view.dart`。预期行为：保留“Web 服务（未启用）”和不可操作说明不变，但两行 `additionalInfo` 改为回显 `_appSettings.webPort` 与 `_appSettings.webServiceWakeLock` 当前值（只读展示）；禁止新增任何 WebService 运行态调用或可编辑入口。验证方式：检索 `_appSettings.webPort/_appSettings.webServiceWakeLock` 的展示代码存在，且文件内不存在 `WebService.start/stop`、`saveWebPort`、`saveWebServiceWakeLock`。","verify_cmd":"rg -n \"Web 服务（未启用）|_appSettings\\.webPort|_appSettings\\.webServiceWakeLock|当前构建排除了 Web 服务|不可操作\" lib/features/settings/views/other_settings_view.dart && ! rg -n \"WebService\\.start|WebService\\.stop|saveWebPort|saveWebServiceWakeLock\" lib/features/settings/views/other_settings_view.dart","required_paths":["lib/features/settings/views/other_settings_view.dart"],"depends_on":["C26-T2"]},{"id":"C26-T4","title":"收敛 OtherSettings 分组顺序与文案到 D-04 口径","priority":4,"prompt":"改动范围：`lib/features/settings/views/other_settings_view.dart`。预期行为：按 D-04 清单固定顺序展示“非 Web 其它设置（9 项：8 布尔 + updateToVariant）”后再展示“Web 服务（未启用）”，避免扩展入口或误导性文案；保持 Cupertino 组件与整行点击语义一致。验证方式：检索两个分组标题和 11 个键在同一文件中完整出现且顺序符合 non-Web 在前、Web 在后。","verify_cmd":"rg -n \"非 Web 其它设置|Web 服务（未启用）|cronet|antiAlias|mediaButtonOnExit|readAloudByMediaButton|ignoreAudioFocus|autoClearExpired|showAddToShelfAlert|updateToVariant|showMangaUi|webPort|webServiceWakeLock\" lib/features/settings/views/other_settings_view.dart","required_paths":["lib/features/settings/views/other_settings_view.dart"],"depends_on":["C26-T3"]},{"id":"C26-T5","title":"回填 D-04 与 R-07 证据文档状态","priority":5,"prompt":"改动范围：`docs/plans/2026-02-26-my-menu-parity-checklist.md`、`docs/plans/evidence/2026-02-26-my-menu-final-regression/R-07-other-settings.md`、`docs/plans/2026-02-27-ui-cupertino-diff.md`。预期行为：基于本轮代码结果回填证据，更新 D-04 为 `in_progress` 或 `done`（依实际落地），明确 `updateToVariant` 三值与 Web 两键只读展示状态；`EX-01` 必须继续标注 `blocked`，不得宣称 WebService 运行态一致。验证方式：检索三份文档中的 D-04/EX-01 状态、11 键描述和三个 variant 值锚点一致。","verify_cmd":"rg -n \"D-04|EX-01|blocked|in_progress|done|cronet|antiAlias|mediaButtonOnExit|readAloudByMediaButton|ignoreAudioFocus|autoClearExpired|showAddToShelfAlert|updateToVariant|showMangaUi|webPort|webServiceWakeLock|default_version|beta_release_version|beta_releaseA_version\" docs/plans/2026-02-26-my-menu-parity-checklist.md docs/plans/evidence/2026-02-26-my-menu-final-regression/R-07-other-settings.md docs/plans/2026-02-27-ui-cupertino-diff.md","required_paths":["docs/plans/2026-02-26-my-menu-parity-checklist.md","docs/plans/evidence/2026-02-26-my-menu-final-regression/R-07-other-settings.md","docs/plans/2026-02-27-ui-cupertino-diff.md"],"depends_on":["C26-T4"]}],"notes":["上一轮失败点集中在任务未真正落地（rc=125）；本批任务改为“先文档差异前置，再单文件实现，再证据回填”的串行收口。","遵循 AGENTS 串行约束：本批仅推进核心 D-04，不展开 EX-01 的 WebService 运行态实现。"]}