{"done":false,"done_reason":"大目标未完成：D-04（其它设置页的 legacy 同义迁移）仍未落地，`other_settings_view.dart` 缺少 non-Web 关键配置入口与 updateToVariant 交互，Web 分组仍是静态占位。","goal_summary":"下一批聚焦 `my_menu_setting -> pref_config_other` 的 UI 迁移闭环：先在其它设置页补齐 non-Web 8 个布尔键与 updateToVariant 选择器，再把 Web 分组改为只读配置回显并收敛文案顺序，最后回填 D-04 证据台账。","tasks":[{"id":"C25-T1","title":"在其它设置页新增 non-Web 8 个布尔项开关分组","priority":1,"prompt":"改动范围：`lib/features/settings/views/other_settings_view.dart`。预期行为：新增“非 Web 其它设置”分组，接入 8 个 legacy 对齐布尔键：`cronet`、`antiAlias`、`mediaButtonOnExit`、`readAloudByMediaButton`、`ignoreAudioFocus`、`autoClearExpired`、`showAddToShelfAlert`、`showMangaUi`；每项使用 `CupertinoListTile.notched + CupertinoSwitch`，同时支持整行点击与拨动开关两种触发，并调用对应 `SettingsService.save*`；页面重进后从 `_appSettings` 正确回显。验证方式：检索 8 个键名、`CupertinoSwitch` 以及对应 `save*` 调用均已接线。","verify_cmd":"rg -n \"非 Web 其它设置|cronet|antiAlias|mediaButtonOnExit|readAloudByMediaButton|ignoreAudioFocus|autoClearExpired|showAddToShelfAlert|showMangaUi|CupertinoSwitch|saveCronet|saveAntiAlias|saveMediaButtonOnExit|saveReadAloudByMediaButton|saveIgnoreAudioFocus|saveAutoClearExpired|saveShowAddToShelfAlert|saveShowMangaUi\" lib/features/settings/views/other_settings_view.dart","required_paths":["lib/features/settings/views/other_settings_view.dart"],"depends_on":[]},{"id":"C25-T2","title":"补齐 updateToVariant 的 Cupertino 选择器与标签回显","priority":2,"prompt":"改动范围：`lib/features/settings/views/other_settings_view.dart`、`lib/core/models/app_settings.dart`（仅在标签映射不可复用时调整）。预期行为：在“非 Web 其它设置”分组加入 `updateToVariant` 条目，点击后用 `showCupertinoModalPopup + CupertinoActionSheet` 展示 3 个 legado 值：`default_version`、`beta_release_version`、`beta_releaseA_version`；选择后调用 `saveUpdateToVariant` 持久化，取消不改值；列表 `additionalInfo` 立即回显当前通道标签（复用 `AppSettings.updateToVariantLabel` 或等价映射）。验证方式：检索选择器链路、3 个值常量、`saveUpdateToVariant` 调用与标签回显代码。","verify_cmd":"rg -n \"updateToVariant|showCupertinoModalPopup|CupertinoActionSheet|CupertinoActionSheetAction|saveUpdateToVariant|default_version|beta_release_version|beta_releaseA_version|updateToVariantLabel\" lib/features/settings/views/other_settings_view.dart lib/core/models/app_settings.dart","required_paths":["lib/features/settings/views/other_settings_view.dart","lib/core/models/app_settings.dart"],"depends_on":["C25-T1"]},{"id":"C25-T3","title":"将 Web 服务分组改为只读配置值展示（保持 EX-01 边界）","priority":3,"prompt":"改动范围：`lib/features/settings/views/other_settings_view.dart`。预期行为：保留“Web 服务（未启用）”分组只读语义，将两行 `additionalInfo` 从固定“未启用”改为展示 `_appSettings.webPort` 与 `_appSettings.webServiceWakeLock` 当前配置值，并保留“当前构建排除了 Web 服务，不可操作”说明；禁止新增任何 WebService 运行态调用与可编辑入口。验证方式：检索 `_appSettings.webPort/_appSettings.webServiceWakeLock` 展示存在，且文件中不存在 `WebService.start/stop`、`saveWebPort`、`saveWebServiceWakeLock`。","verify_cmd":"rg -n \"Web 服务（未启用）|_appSettings\\.webPort|_appSettings\\.webServiceWakeLock|当前构建排除了 Web 服务|不可操作\" lib/features/settings/views/other_settings_view.dart && ! rg -n \"WebService\\.start|WebService\\.stop|saveWebPort|saveWebServiceWakeLock\" lib/features/settings/views/other_settings_view.dart","required_paths":["lib/features/settings/views/other_settings_view.dart"],"depends_on":["C25-T1","C25-T2"]},{"id":"C25-T4","title":"按 D-04 清单收敛其它设置页分组顺序与文案","priority":4,"prompt":"改动范围：`lib/features/settings/views/other_settings_view.dart`。预期行为：在同一页面完成 D-04 要求的可见语义收敛，确保先展示 non-Web 配置（8 布尔项 + `updateToVariant`），再展示 Web 只读边界组；标题、辅助文案与条目顺序不引入扩展入口或误导性操作描述。验证方式：检索“非 Web 其它设置”“Web 服务（未启用）”及 11 个键名（含 `webPort`、`webServiceWakeLock`）在页面定义中完整出现。","verify_cmd":"rg -n \"非 Web 其它设置|Web 服务（未启用）|cronet|antiAlias|mediaButtonOnExit|readAloudByMediaButton|ignoreAudioFocus|autoClearExpired|showAddToShelfAlert|updateToVariant|showMangaUi|webPort|webServiceWakeLock\" lib/features/settings/views/other_settings_view.dart","required_paths":["lib/features/settings/views/other_settings_view.dart"],"depends_on":["C25-T3"]},{"id":"C25-T5","title":"回填 D-04 台账与 R-07 证据为代码实况","priority":5,"prompt":"改动范围：`docs/plans/2026-02-26-my-menu-parity-checklist.md`、`docs/plans/evidence/2026-02-26-my-menu-final-regression/R-07-other-settings.md`、`docs/plans/2026-02-27-ui-cupertino-diff.md`。预期行为：基于本轮代码结果更新 D-04 状态（`in_progress` 或 `done`），逐项回填 9 个 non-Web 键与 2 个 Web 边界键证据；明确 `EX-01` 仍为 `blocked` 且仅只读展示，不宣称 WebService 运行态一致。验证方式：检索三份文档中 D-04/EX-01 状态与 11 键描述一致，且包含 `updateToVariant` 三个值锚点。","verify_cmd":"rg -n \"D-04|EX-01|done|in_progress|blocked|cronet|antiAlias|mediaButtonOnExit|readAloudByMediaButton|ignoreAudioFocus|autoClearExpired|showAddToShelfAlert|updateToVariant|showMangaUi|webPort|webServiceWakeLock|default_version|beta_release_version|beta_releaseA_version\" docs/plans/2026-02-26-my-menu-parity-checklist.md docs/plans/evidence/2026-02-26-my-menu-final-regression/R-07-other-settings.md docs/plans/2026-02-27-ui-cupertino-diff.md","required_paths":["docs/plans/2026-02-26-my-menu-parity-checklist.md","docs/plans/evidence/2026-02-26-my-menu-final-regression/R-07-other-settings.md","docs/plans/2026-02-27-ui-cupertino-diff.md"],"depends_on":["C25-T4"]}],"notes":["`lib/core/models/app_settings.dart` 与 `lib/core/services/settings_service.dart` 中 `updateToVariant` 合法值与保存回退逻辑已存在，本轮不重复拆分该底层任务。","遵循 AGENTS：核心链路先做 D-04，`EX-01` 继续保持 blocked，仅允许只读语义展示。"]}