{"done":false,"done_reason":"大目标未完成：导航专项 `N-VAL-01` 仍是 pending，四份回归证据文件仍为占位状态，且多份台账仍保留已过期的 `NAV-DIFF-01` 未修复描述。","goal_summary":"下一批任务应先补齐导航回归证据守卫与证据回填，再统一收口 UI 差异台账与跨文档状态，形成可验收闭环。","tasks":[{"id":"C40-T1","title":"新增导航回归证据守卫脚本（字段与占位词校验）","priority":1,"prompt":"改动范围：新增 `tool/ui_nav_regression_guard.sh`。脚本固定校验 `docs/plans/evidence/2026-02-27-ui-nav-final-regression/R-N01-bookshelf.md`、`R-N02-discovery.md`、`R-N03-rss.md`、`R-N04-settings.md` 四个文件，要求每个文件都包含字段“入口/目标/步骤/结果/处理动作/验证命令/命中摘要/关联锚点”，并在严格模式拦截占位词“待验证|待回填|未回归”。脚本需支持 `--mode=structure`（只校验字段）与 `--mode=strict`（字段+占位词）两种模式。预期行为：结构校验可用于开发中快速检查；严格校验用于收口门禁。验证方式：脚本可执行，`--mode=structure` 当前应通过并输出每个文件检查结果。","verify_cmd":"test -x tool/ui_nav_regression_guard.sh && bash tool/ui_nav_regression_guard.sh --mode=structure","required_paths":["tool/ui_nav_regression_guard.sh","docs/plans/evidence/2026-02-27-ui-nav-final-regression/R-N01-bookshelf.md","docs/plans/evidence/2026-02-27-ui-nav-final-regression/R-N02-discovery.md","docs/plans/evidence/2026-02-27-ui-nav-final-regression/R-N03-rss.md","docs/plans/evidence/2026-02-27-ui-nav-final-regression/R-N04-settings.md"],"depends_on":[]},{"id":"C40-T2","title":"回填四页导航回归证据并通过严格校验","priority":2,"prompt":"改动范围：更新 `docs/plans/evidence/2026-02-27-ui-nav-final-regression/` 下 `R-N01~R-N04` 四份证据文档。按文件内既定步骤回填真实回归结论，至少替换“结果/处理动作/命中摘要”的占位内容；每份文档补充“排版布局一致性”明确结论（符合 AGENTS 1.2.1）；`R-N03` 需明确记录 noEnabled 空态按钮进入订阅源管理语义已对齐。预期行为：四份文档不再包含“待验证/待回填/未回归”等占位词，可作为 `N-VAL-01` 收口依据。验证方式：执行严格模式守卫通过，且证据文件无占位词。","verify_cmd":"bash tool/ui_nav_regression_guard.sh --mode=strict && ! rg -n \"待验证|待回填|未回归\" docs/plans/evidence/2026-02-27-ui-nav-final-regression/R-N0*.md","required_paths":["docs/plans/evidence/2026-02-27-ui-nav-final-regression/R-N01-bookshelf.md","docs/plans/evidence/2026-02-27-ui-nav-final-regression/R-N02-discovery.md","docs/plans/evidence/2026-02-27-ui-nav-final-regression/R-N03-rss.md","docs/plans/evidence/2026-02-27-ui-nav-final-regression/R-N04-settings.md","tool/ui_nav_regression_guard.sh"],"depends_on":["C40-T1"]},{"id":"C40-T3","title":"收口 UI 差异台账中的 N-03/N-VAL-01 状态","priority":3,"prompt":"改动范围：`docs/plans/2026-02-27-ui-cupertino-diff.md`。基于当前代码事实（`rss_subscription_view.dart` 的 noEnabled 分支已调用 `_openSourceSettings`）移除 `NAV-DIFF-01` 未修复描述；将 `N-03` 从“剩余差异待修复”更新为“行为已修复，待证据收口/或已收口”；将 `N-VAL-01` 从 `pending` 更新为完成态，并补充 `R-N01~R-N04` 证据引用。预期行为：该台账不再出现“前置行为差异待修复/证据待回填”的过期表述，导航专项状态与证据一致。验证方式：检索 `N-VAL-01`、`NAV-DIFF-01`、`pending` 关键字确认收口语义。","verify_cmd":"rg -n \"N-03|N-VAL-01|R-N01~R-N04|已完成|done\" docs/plans/2026-02-27-ui-cupertino-diff.md && ! rg -n \"Navigator\\.maybePop|前置行为差异待修复|N-VAL-01.*pending|证据待回填\" docs/plans/2026-02-27-ui-cupertino-diff.md","required_paths":["docs/plans/2026-02-27-ui-cupertino-diff.md","lib/features/rss/views/rss_subscription_view.dart","docs/plans/evidence/2026-02-27-ui-nav-final-regression/R-N03-rss.md"],"depends_on":["C40-T2"]},{"id":"C40-T4","title":"同步主计划与 my-menu 台账的导航收口状态","priority":4,"prompt":"改动范围：`PLANS.md`、`docs/plans/2026-02-26-my-menu-id-diff.md`、`docs/plans/2026-02-26-my-menu-parity-checklist.md`。将三份文档中与导航专项相关的 `N-01~N-04` 与 `N-VAL-01` 状态同步到与 UI 差异台账一致（完成态），并补充证据文件路径引用，删除“证据待回填”旧描述。预期行为：跨文档状态一致，不再存在一个文档 done、另一个文档 pending 的冲突。验证方式：一次检索确认三份文档均出现完成态且不再含 `N-VAL-01=pending`。","verify_cmd":"rg -n \"N-VAL-01|N-01~N-04|R-N01~R-N04|已完成|done\" PLANS.md docs/plans/2026-02-26-my-menu-id-diff.md docs/plans/2026-02-26-my-menu-parity-checklist.md && ! rg -n \"N-VAL-01=pending|证据待回填\" PLANS.md docs/plans/2026-02-26-my-menu-id-diff.md docs/plans/2026-02-26-my-menu-parity-checklist.md","required_paths":["PLANS.md","docs/plans/2026-02-26-my-menu-id-diff.md","docs/plans/2026-02-26-my-menu-parity-checklist.md","docs/plans/2026-02-27-ui-cupertino-diff.md"],"depends_on":["C40-T3"]},{"id":"C40-T5","title":"补齐导航专项收口后的定向扫描摘要","priority":5,"prompt":"改动范围：`docs/plans/2026-02-27-ui-cupertino-diff.md` 与 `PLANS.md`。在收口结论处补充一次最终定向扫描摘要：`showGeneralDialog`、`shadcn_ui`、`package:flutter/material.dart` 命中为 0，四个核心页 `useSliverNavigationBar: true` 命中为 4，并将命中文件路径更新为当前代码行位置信息。预期行为：文档中的“完成态”不仅有状态结论，还有与当前仓库一致的扫描证据。验证方式：执行定向 `rg` 命令与文档摘要一致。","verify_cmd":"rg -n \"showGeneralDialog|shadcn_ui|package:flutter/material.dart\" lib && exit 1 || true; rg -n \"useSliverNavigationBar:\\s*true\" lib/features/bookshelf/views/bookshelf_view.dart lib/features/discovery/views/discovery_view.dart lib/features/rss/views/rss_subscription_view.dart lib/features/settings/views/settings_view.dart","required_paths":["docs/plans/2026-02-27-ui-cupertino-diff.md","PLANS.md","lib/features/bookshelf/views/bookshelf_view.dart","lib/features/discovery/views/discovery_view.dart","lib/features/rss/views/rss_subscription_view.dart","lib/features/settings/views/settings_view.dart"],"depends_on":["C40-T4"]}],"notes":["`lib/features/rss/views/rss_subscription_view.dart` 中 noEnabled 分支已是 `_openSourceSettings`，后续任务重点是证据与台账收口而非重复改代码。","遵循 AGENTS：本批验证均采用定向命令，不使用 `flutter analyze`。"]}