{"done":false,"done_reason":"大目标未完成：核心页大标题导航收口链路里，订阅页仍缺少 tab 重按回顶接线，且空态主动作仍有根页无反馈风险；另外需补一次定向静态校验确保主导航参数链路闭环。","goal_summary":"下一批任务聚焦 N-03/N-04 代码闭环：先补齐订阅页 reselect 信号与空态动作，再对齐主导航重按语义并做定向静态校验，确保四核心页的 Cupertino 大标题交互一致。","tasks":[{"id":"C36-T1","title":"订阅页接入 reselectSignal 并完成回顶监听生命周期","priority":1,"prompt":"改动范围：`lib/features/rss/views/rss_subscription_view.dart`。为 `RssSubscriptionView` 增加可选参数 `ValueListenable<int>? reselectSignal`，在 State 中新增版本去重字段，并补齐 `initState/didUpdateWidget/dispose` 的监听绑定与解绑；收到新版本信号时复用现有 `_scrollController` 执行回顶（`animateTo(0)`）。预期行为：双击底部“订阅”tab 时，订阅页滚动到顶部并恢复 large title 展开；不改变现有筛选、分组、列表渲染。验证方式：检查参数、生命周期监听、回顶调用与 `useSliverNavigationBar: true` 均存在。","verify_cmd":"rg -n \"class RssSubscriptionView|reselectSignal|ValueListenable<int>|didUpdateWidget|addListener|removeListener|animateTo\\(|_scrollController|useSliverNavigationBar:\\s*true\" lib/features/rss/views/rss_subscription_view.dart && dart format --output=none --set-exit-if-changed lib/features/rss/views/rss_subscription_view.dart","required_paths":["lib/features/rss/views/rss_subscription_view.dart"],"depends_on":[]},{"id":"C36-T2","title":"修正订阅空态主动作为订阅源管理入口","priority":2,"prompt":"改动范围：`lib/features/rss/views/rss_subscription_view.dart`。调整 `_buildEmptyState` 中 `noEnabled` 分支按钮行为：由 `Navigator.of(context).maybePop()` 改为调用 `_openSourceSettings`，保留“没有匹配结果”分支的清空筛选逻辑不变。预期行为：当订阅页作为根页且无启用订阅源时，点击空态按钮可稳定进入订阅源管理，不出现点击无响应。验证方式：`noEnabled` 分支不再出现 `maybePop()`，而是调用 `_openSourceSettings`。","verify_cmd":"rg -n \"暂无启用订阅源|没有匹配结果|_openSourceSettings|maybePop\\(\" lib/features/rss/views/rss_subscription_view.dart && ! rg -n \"noEnabled[\\s\\S]*maybePop\\(\" lib/features/rss/views/rss_subscription_view.dart && dart format --output=none --set-exit-if-changed lib/features/rss/views/rss_subscription_view.dart","required_paths":["lib/features/rss/views/rss_subscription_view.dart"],"depends_on":["C36-T1"]},{"id":"C36-T3","title":"主导航重按语义收敛到“仅当前 tab 双击触发”","priority":3,"prompt":"改动范围：`lib/main.dart`。收敛 `_onTabTap` 逻辑：仅当点击当前已激活 tab 且满足双击窗口时才派发 `_bookshelfReselectSignal/_discoveryCompressSignal/_rssReselectSignal/_myReselectSignal`；切换到其他 tab 时只做状态重置，不派发任何重按信号。预期行为：四个 tab 的重按触发条件一致，避免跨 tab 误触发回顶/压缩动作。验证方式：`_onTabTap` 中存在“切换 tab 与重按当前 tab”分支分离，四个信号分发分支完整。","verify_cmd":"rg -n \"_onTabTap\\(|_legacyReselectWindow|_lastReselectedTab|_bookshelfReselectSignal|_discoveryCompressSignal|_rssReselectSignal|_myReselectSignal\" lib/main.dart && dart format --output=none --set-exit-if-changed lib/main.dart","required_paths":["lib/main.dart"],"depends_on":[]},{"id":"C36-T4","title":"补齐主导航到订阅页/我的页的参数链路并消除构造不匹配","priority":4,"prompt":"改动范围：`lib/main.dart`、`lib/features/rss/views/rss_subscription_view.dart`、`lib/features/settings/views/settings_view.dart`。确保 `MainScreen` 构建 `RssSubscriptionView` 与 `SettingsView` 时传入的 `reselectSignal` 与页面构造参数完全一致，修复任何命名参数不匹配或未使用字段问题。预期行为：底部导航到“订阅/我的”的重按信号链路可静态通过，且不引入 Material 组件。验证方式：定向检索构造参数声明与调用点，确认 `reselectSignal` 在声明和调用两侧一致。","verify_cmd":"rg -n \"RssSubscriptionView\\(|SettingsView\\(|final ValueListenable<int>\\? reselectSignal\" lib/main.dart lib/features/rss/views/rss_subscription_view.dart lib/features/settings/views/settings_view.dart && ! rg -n \"package:flutter/material.dart\" lib/main.dart lib/features/rss/views/rss_subscription_view.dart lib/features/settings/views/settings_view.dart","required_paths":["lib/main.dart","lib/features/rss/views/rss_subscription_view.dart","lib/features/settings/views/settings_view.dart"],"depends_on":["C36-T1","C36-T3"]},{"id":"C36-T5","title":"四核心页导航专项定向静态校验收口","priority":5,"prompt":"改动范围：`lib/main.dart`、`lib/features/bookshelf/views/bookshelf_view.dart`、`lib/features/discovery/views/discovery_view.dart`、`lib/features/rss/views/rss_subscription_view.dart`、`lib/features/settings/views/settings_view.dart`。在完成前述改动后，执行一次仅针对导航专项链路的静态校验；若出现错误，仅修补与本链路直接相关的问题。预期行为：四核心页 `useSliverNavigationBar: true` 与重按/压缩信号链路全部可编译通过。验证方式：先 `rg` 校验关键符号，再运行 `dart analyze` 定向文件列表且无 error。","verify_cmd":"rg -n \"useSliverNavigationBar:\\s*true\" lib/features/bookshelf/views/bookshelf_view.dart lib/features/discovery/views/discovery_view.dart lib/features/rss/views/rss_subscription_view.dart lib/features/settings/views/settings_view.dart && rg -n \"reselectSignal|compressSignal|animateTo\\(\" lib/main.dart lib/features/bookshelf/views/bookshelf_view.dart lib/features/discovery/views/discovery_view.dart lib/features/rss/views/rss_subscription_view.dart lib/features/settings/views/settings_view.dart && dart analyze lib/main.dart lib/features/bookshelf/views/bookshelf_view.dart lib/features/discovery/views/discovery_view.dart lib/features/rss/views/rss_subscription_view.dart lib/features/settings/views/settings_view.dart","required_paths":["lib/main.dart","lib/features/bookshelf/views/bookshelf_view.dart","lib/features/discovery/views/discovery_view.dart","lib/features/rss/views/rss_subscription_view.dart","lib/features/settings/views/settings_view.dart"],"depends_on":["C36-T2","C36-T4"]}],"notes":["上一轮失败记录为 `C35-T1 exhausted retries`，但当前仓库显示 `settings_view.dart` 的 reselect 改动已存在；本轮不重复该文件实现，仅围绕未闭环的 RSS/主导航链路推进。","本批任务均为可执行编码任务，未包含 `flutter analyze`，符合 AGENTS 的开发过程约束。"]}