{"done":false,"done_reason":"大目标未完成：`N-03` 仍存在空态按钮行为差异（`maybePop`），`N-VAL-01` 的 R-N01~R-N04 回归证据与跨台账收口仍处于 pending。","goal_summary":"下一批任务聚焦“先固化差异清单，再修复订阅页行为，最后完成证据守卫、证据回填与台账状态统一收口”，推动 UI 迁移链路从 `in_progress/pending` 进入可验收完成态。","tasks":[{"id":"C38-T1","title":"先行固化 N-03 剩余差异清单与前置门槛","priority":1,"prompt":"改动范围：`docs/plans/2026-02-27-ui-cupertino-diff.md`。在 `N-03` 与 `N-VAL-01` 条目中明确写实当前差异：`RssSubscriptionView` 空态 `noEnabled` 分支仍使用 `Navigator.maybePop`，与 legado 语义“进入订阅源管理”不一致；补充“修复该差异后方可进行 R-N01~R-N04 证据回填”的前置门槛，并保持 `EX-NAV-01` 等例外记录不变。预期行为：台账先于实现准确反映真实阻塞点，满足迁移任务先差异清单后实现的约束。验证方式：检索文档中同时存在 `N-03`、`N-VAL-01`、`NAV-DIFF-01`、`maybePop`、`_openSourceSettings` 相关描述。","verify_cmd":"rg -n \"N-03|N-VAL-01|NAV-DIFF-01|maybePop|_openSourceSettings|前置\" docs/plans/2026-02-27-ui-cupertino-diff.md","required_paths":["docs/plans/2026-02-27-ui-cupertino-diff.md"],"depends_on":[]},{"id":"C38-T2","title":"修复订阅页空态按钮为进入订阅源管理","priority":2,"prompt":"改动范围：`lib/features/rss/views/rss_subscription_view.dart`。将 `_buildEmptyState` 中 `noEnabled` 分支按钮点击行为从 `Navigator.of(context).maybePop()` 改为调用 `_openSourceSettings`，并保持“没有匹配结果”分支的清空筛选逻辑不变。预期行为：订阅页作为根页时点击“返回订阅源管理”始终可进入订阅源管理页面，不再出现无响应回退；其余筛选、分组与列表渲染行为不变。验证方式：定向检索 `maybePop` 已从该空态逻辑移除，且 `_openSourceSettings` 仍被空态按钮使用，并通过格式校验。","verify_cmd":"rg -n \"_buildEmptyState|暂无启用订阅源|没有匹配结果|_openSourceSettings|maybePop\\(\" lib/features/rss/views/rss_subscription_view.dart && ! rg -n \"maybePop\\(\" lib/features/rss/views/rss_subscription_view.dart && dart format --output=none --set-exit-if-changed lib/features/rss/views/rss_subscription_view.dart","required_paths":["lib/features/rss/views/rss_subscription_view.dart"],"depends_on":["C38-T1"]},{"id":"C38-T3","title":"新增 UI 导航证据守卫脚本","priority":3,"prompt":"改动范围：新增 `tool/ui_nav_regression_guard.sh`。脚本需校验 `docs/plans/evidence/2026-02-27-ui-nav-final-regression/` 下 `R-N01~R-N04` 四份证据的必填字段完整性（入口、目标、步骤、结果、处理动作、验证命令、命中摘要、关联锚点），并拦截占位词（如“待验证/待回填/未回归”）。预期行为：可通过单命令判断 N-VAL-01 证据是否可交付，任一证据缺项或仍占位时返回非 0。验证方式：脚本存在且可执行，并包含四份证据与占位词检查规则。","verify_cmd":"test -x tool/ui_nav_regression_guard.sh && rg -n \"R-N01|R-N02|R-N03|R-N04|待验证|待回填|未回归|关联锚点|命中摘要|验证命令\" tool/ui_nav_regression_guard.sh","required_paths":["tool/ui_nav_regression_guard.sh"],"depends_on":["C38-T1"]},{"id":"C38-T4","title":"回填 R-N01~R-N04 手工回归证据并跑守卫","priority":4,"prompt":"改动范围：`docs/plans/evidence/2026-02-27-ui-nav-final-regression/R-N01-bookshelf.md`、`R-N02-discovery.md`、`R-N03-rss.md`、`R-N04-settings.md`。按各文件既有回归步骤执行手工验证后，将“结果/处理动作/命中摘要/排版布局一致性结论”从占位态改为真实结论；若发现偏差，按 AGENTS 1.1.2 记录影响与回补计划。预期行为：四份证据均不含占位文案，且可作为 N-VAL-01 收口依据。验证方式：执行守卫脚本通过，且证据文件中不再出现占位词。","verify_cmd":"bash tool/ui_nav_regression_guard.sh && ! rg -n \"待验证|待回填|未回归\" docs/plans/evidence/2026-02-27-ui-nav-final-regression/R-N0*.md","required_paths":["docs/plans/evidence/2026-02-27-ui-nav-final-regression/R-N01-bookshelf.md","docs/plans/evidence/2026-02-27-ui-nav-final-regression/R-N02-discovery.md","docs/plans/evidence/2026-02-27-ui-nav-final-regression/R-N03-rss.md","docs/plans/evidence/2026-02-27-ui-nav-final-regression/R-N04-settings.md","tool/ui_nav_regression_guard.sh"],"depends_on":["C38-T2","C38-T3"]},{"id":"C38-T5","title":"补齐 UI 导航最终回归汇总页","priority":5,"prompt":"改动范围：新增 `docs/plans/2026-02-27-ui-nav-final-regression.md`。建立 `R-N01~R-N04` 四个章节，写明每项结果摘要、证据文件路径、处理动作与 `N-AC-01~N-AC-03`、排版布局一致性结论，确保可快速追溯。预期行为：形成单一审阅入口，审阅者无需分散打开四份证据即可判断导航专项是否达标。验证方式：文档包含四个章节锚点与 `N-AC-01~N-AC-03` 结论字段。","verify_cmd":"rg -n \"R-N01|R-N02|R-N03|R-N04|N-AC-01|N-AC-02|N-AC-03|排版布局一致性|#ui-nav-r-n01|#ui-nav-r-n02|#ui-nav-r-n03|#ui-nav-r-n04\" docs/plans/2026-02-27-ui-nav-final-regression.md","required_paths":["docs/plans/2026-02-27-ui-nav-final-regression.md"],"depends_on":["C38-T4"]},{"id":"C38-T6","title":"统一主台账与联动台账的 N-VAL-01 完成状态","priority":6,"prompt":"改动范围：`PLANS.md`、`docs/plans/2026-02-27-ui-cupertino-diff.md`、`docs/plans/2026-02-26-my-menu-id-diff.md`、`docs/plans/2026-02-26-my-menu-parity-checklist.md`。在证据完成后，将 `N-01~N-04` 与 `N-VAL-01` 从 `in_progress/pending` 收口到完成态，补充对应证据链接；保持 `EX-01` 等 blocked 条目原状不变。预期行为：四份台账对同一状态描述一致，不再出现“代码或证据已完成但文档仍 pending”的不一致。验证方式：检索四份文档中 `N-VAL-01` 状态一致且不再含“证据待回填/待验证/pending”描述。","verify_cmd":"rg -n \"N-VAL-01|N-01~N-04|R-N01~R-N04|done|已完成\" PLANS.md docs/plans/2026-02-27-ui-cupertino-diff.md docs/plans/2026-02-26-my-menu-id-diff.md docs/plans/2026-02-26-my-menu-parity-checklist.md && ! rg -n \"N-VAL-01.*pending|证据待回填|待验证\" PLANS.md docs/plans/2026-02-27-ui-cupertino-diff.md docs/plans/2026-02-26-my-menu-id-diff.md docs/plans/2026-02-26-my-menu-parity-checklist.md","required_paths":["PLANS.md","docs/plans/2026-02-27-ui-cupertino-diff.md","docs/plans/2026-02-26-my-menu-id-diff.md","docs/plans/2026-02-26-my-menu-parity-checklist.md"],"depends_on":["C38-T5"]}],"notes":["本批次遵循 AGENTS 迁移顺序：先差异清单、再代码修复、再证据回填与台账收口。","验证命令均为定向校验，未使用 `flutter analyze`（提交前最终验收阶段再执行）。"]}