{"done":false,"done_reason":"目标未完成：`D-04（其它设置 non-Web 键闭环）`仍未在 `other_settings_view.dart` 落地，且 `N-VAL-01` 四页导航证据仍为待回填状态。","goal_summary":"下一批先按 AGENTS 要求补齐 D-04 的差异清单与 UI 持久化闭环（严格保持 EX-01 不接 WebService 运行态），再收口导航证据与台账状态。","tasks":[{"id":"C23-T1","title":"先回填 D-04 差异清单（legado 对照）","priority":1,"prompt":"改动范围：`docs/plans/2026-02-26-my-menu-parity-checklist.md`。预期行为：在 D-04 小节新增“已实现/未实现”差异清单，逐项列出 9 个 non-Web 键（`cronet`、`antiAlias`、`mediaButtonOnExit`、`readAloudByMediaButton`、`ignoreAudioFocus`、`autoClearExpired`、`showAddToShelfAlert`、`updateToVariant`、`showMangaUi`）与 2 个 Web 边界键（`webPort`、`webServiceWakeLock`）当前状态；补充 `updateToVariant` 的 legado 取值锚点（`default_version`、`beta_release_version`、`beta_releaseA_version`）。验证方式：定向检索 D-04 清单是否完整且包含 11 个键与 3 个 variant 值。","verify_cmd":"rg -n \"D-04|cronet|antiAlias|mediaButtonOnExit|readAloudByMediaButton|ignoreAudioFocus|autoClearExpired|showAddToShelfAlert|updateToVariant|showMangaUi|webPort|webServiceWakeLock|default_version|beta_release_version|beta_releaseA_version\" docs/plans/2026-02-26-my-menu-parity-checklist.md","required_paths":["docs/plans/2026-02-26-my-menu-parity-checklist.md"],"depends_on":[]},{"id":"C23-T2","title":"在 OtherSettingsView 落地 8 个 non-Web 布尔开关","priority":2,"prompt":"改动范围：`lib/features/settings/views/other_settings_view.dart`。预期行为：新增“非 Web 其它设置”分组并接通 8 个布尔项（`cronet`、`antiAlias`、`mediaButtonOnExit`、`readAloudByMediaButton`、`ignoreAudioFocus`、`autoClearExpired`、`showAddToShelfAlert`、`showMangaUi`）；每项均使用 `CupertinoListTile.notched + CupertinoSwitch`，同时支持点击整行与拨动开关两种触发，调用对应 `SettingsService.save*`，页面重进后从 `_appSettings` 正确回显。验证方式：检索 8 个键名、`CupertinoSwitch`、对应 `save*` 调用全部存在。","verify_cmd":"rg -n \"非 Web 其它设置|cronet|antiAlias|mediaButtonOnExit|readAloudByMediaButton|ignoreAudioFocus|autoClearExpired|showAddToShelfAlert|showMangaUi|CupertinoSwitch|saveCronet|saveAntiAlias|saveMediaButtonOnExit|saveReadAloudByMediaButton|saveIgnoreAudioFocus|saveAutoClearExpired|saveShowAddToShelfAlert|saveShowMangaUi\" lib/features/settings/views/other_settings_view.dart","required_paths":["lib/features/settings/views/other_settings_view.dart","lib/core/services/settings_service.dart","lib/core/models/app_settings.dart"],"depends_on":["C23-T1"]},{"id":"C23-T3","title":"补齐 updateToVariant 选择器与持久化","priority":3,"prompt":"改动范围：`lib/features/settings/views/other_settings_view.dart`（必要时补充 `lib/core/models/app_settings.dart` 常量映射）。预期行为：为 `updateToVariant` 增加可操作入口，使用 iOS 风格 `CupertinoActionSheet`（或等价 Cupertino 选择控件）提供 3 个 legado 对齐选项：`default_version`、`beta_release_version`、`beta_releaseA_version`；选择后调用 `saveUpdateToVariant` 持久化并立即回显当前标签；取消不改值。验证方式：检索 3 个 variant 值、选择器调用链、`saveUpdateToVariant` 调用与当前值展示。","verify_cmd":"rg -n \"updateToVariant|default_version|beta_release_version|beta_releaseA_version|saveUpdateToVariant|showCupertinoModalPopup|CupertinoActionSheet|CupertinoActionSheetAction\" lib/features/settings/views/other_settings_view.dart lib/core/models/app_settings.dart","required_paths":["lib/features/settings/views/other_settings_view.dart","lib/core/models/app_settings.dart","lib/core/services/settings_service.dart"],"depends_on":["C23-T2"]},{"id":"C23-T4","title":"Web 服务分组改为读取配置值的只读展示","priority":4,"prompt":"改动范围：`lib/features/settings/views/other_settings_view.dart`。预期行为：保持 `EX-01` 边界不变，将“Web 服务（未启用）”分组从固定“未启用”文本改为读取 `_appSettings.webPort` 与 `_appSettings.webServiceWakeLock` 并展示当前配置值，同时保留“当前构建排除了 Web 服务”只读说明；该分组不可编辑、不可触发运行态行为。验证方式：检索 `_appSettings.webPort/_appSettings.webServiceWakeLock` 展示与只读文案存在，且无 `saveWebPort/saveWebServiceWakeLock/WebService.start/stop`。","verify_cmd":"rg -n \"Web 服务（未启用）|当前构建排除了 Web 服务|_appSettings\\.webPort|_appSettings\\.webServiceWakeLock\" lib/features/settings/views/other_settings_view.dart && ! rg -n \"saveWebPort|saveWebServiceWakeLock|WebService\\.start|WebService\\.stop\" lib/features/settings/views/other_settings_view.dart","required_paths":["lib/features/settings/views/other_settings_view.dart","lib/core/models/app_settings.dart"],"depends_on":["C23-T3"]},{"id":"C23-T5","title":"回填 D-04 与 R-07 证据状态","priority":5,"prompt":"改动范围：`docs/plans/2026-02-26-my-menu-parity-checklist.md`、`docs/plans/evidence/2026-02-26-my-menu-final-regression/R-07-other-settings.md`、`docs/plans/2026-02-27-ui-cupertino-diff.md`。预期行为：按代码实况更新 D-04 为精确状态（`done` 或 `in_progress`），在 R-07 增补 9 个 non-Web 键与 `updateToVariant` 的“入口可操作 + 保存调用 + 回显”证据；明确 `EX-01` 仍是 `blocked` 且仅只读展示。验证方式：检索三份文档中的 D-04/EX-01 状态与 9+2 键描述一致。","verify_cmd":"rg -n \"D-04|EX-01|cronet|antiAlias|mediaButtonOnExit|readAloudByMediaButton|ignoreAudioFocus|autoClearExpired|showAddToShelfAlert|updateToVariant|showMangaUi|webPort|webServiceWakeLock|done|in_progress|blocked\" docs/plans/2026-02-26-my-menu-parity-checklist.md docs/plans/evidence/2026-02-26-my-menu-final-regression/R-07-other-settings.md docs/plans/2026-02-27-ui-cupertino-diff.md","required_paths":["docs/plans/2026-02-26-my-menu-parity-checklist.md","docs/plans/evidence/2026-02-26-my-menu-final-regression/R-07-other-settings.md","docs/plans/2026-02-27-ui-cupertino-diff.md"],"depends_on":["C23-T4"]},{"id":"C23-T6","title":"收口 N-VAL-01 四页导航证据并同步台账","priority":6,"prompt":"改动范围：`docs/plans/evidence/2026-02-27-ui-nav-final-regression/R-N01-bookshelf.md`、`R-N02-discovery.md`、`R-N03-rss.md`、`R-N04-settings.md`、`docs/plans/2026-02-27-ui-cupertino-diff.md`。预期行为：将四份导航证据从“待回填/未回归”更新为实际回归结论，至少覆盖 `N-AC-01~03`（大标题折叠、滚动稳定、根页不误退/二级页侧滑返回）和“排版布局一致性”；同步更新台账中 `N-01~N-04` 与 `N-VAL-01` 状态。验证方式：四份证据中不再出现“状态:待回填/未回归”，且台账状态与证据一致。","verify_cmd":"! rg -n \"状态:待回填|未回归|结果: `待验证`\" docs/plans/evidence/2026-02-27-ui-nav-final-regression/R-N01-bookshelf.md docs/plans/evidence/2026-02-27-ui-nav-final-regression/R-N02-discovery.md docs/plans/evidence/2026-02-27-ui-nav-final-regression/R-N03-rss.md docs/plans/evidence/2026-02-27-ui-nav-final-regression/R-N04-settings.md && rg -n \"N-01|N-02|N-03|N-04|N-VAL-01|done|in_progress|pending\" docs/plans/2026-02-27-ui-cupertino-diff.md","required_paths":["docs/plans/evidence/2026-02-27-ui-nav-final-regression/R-N01-bookshelf.md","docs/plans/evidence/2026-02-27-ui-nav-final-regression/R-N02-discovery.md","docs/plans/evidence/2026-02-27-ui-nav-final-regression/R-N03-rss.md","docs/plans/evidence/2026-02-27-ui-nav-final-regression/R-N04-settings.md","docs/plans/2026-02-27-ui-cupertino-diff.md"],"depends_on":["C23-T5"]}],"notes":["上一轮失败记录 `rc=125` 与 `C22-T1` 实际代码已落地不一致，建议后续 verify 命令对“无命中即通过”的条件使用 `! rg ...`，避免把预期无结果判为失败。","当前代码现状：`settings_service.dart` 的 9 个 `save*` 已存在；主要缺口集中在 `other_settings_view.dart` 的 UI 接线与文档收口。"]}