{"done":false,"done_reason":"大目标未完成：`other_settings_view.dart` 的 Web 区仍是静态“未启用”，且 `R-N01~R-N04` 证据仍为“待验证/待回填”，跨台账状态仍停留在 `D-04=in_progress`、`N-VAL-01=pending`。","goal_summary":"先收口 Other 设置页 Web 边界只读回显，再完成四个核心页导航回归证据回填，最后统一更新台账状态。","tasks":[{"id":"C33-T1","title":"收口 Other 设置页 Web 边界只读回显","priority":1,"prompt":"改动范围：`lib/features/settings/views/other_settings_view.dart`（可只读参考 `lib/core/models/app_settings.dart`，不要改服务层）。预期行为：保留 `EX-01` 边界（不可操作、不接入运行态），但将“Web 端口”“WebService 唤醒锁”从静态“未启用”改为只读显示当前配置值（示例：`未启用（当前: 1122）`、`未启用（当前: 开/关）`），并继续显示“当前构建排除了 Web 服务”说明。验证方式：1) 代码命中 `_appSettings.webPort` 与 `_appSettings.webServiceWakeLock`；2) 未引入 `WebService.start/stop`、`saveWebPort`、`saveWebServiceWakeLock`；3) 目标文件格式检查通过。","verify_cmd":"rg -n \"_appSettings\\.webPort|_appSettings\\.webServiceWakeLock|Web 服务（未启用）|未启用（当前\" lib/features/settings/views/other_settings_view.dart && ! rg -n \"WebService\\.start|WebService\\.stop|saveWebPort|saveWebServiceWakeLock\" lib/features/settings/views/other_settings_view.dart && dart format --output=none --set-exit-if-changed lib/features/settings/views/other_settings_view.dart","required_paths":["lib/features/settings/views/other_settings_view.dart","lib/core/models/app_settings.dart"],"depends_on":[]},{"id":"C33-T2","title":"同步 D-04 相关台账与 R-07 证据口径","priority":2,"prompt":"改动范围：`docs/plans/2026-02-26-my-menu-id-diff.md`、`docs/plans/2026-02-26-my-menu-parity-checklist.md`、`docs/plans/evidence/2026-02-26-my-menu-final-regression/R-07-other-settings.md`。预期行为：清理“`updateToVariant` 仍缺失”的过期描述，统一改为“`updateToVariant` 已闭环”；结合 C33-T1 将 Web 边界改写为“仅只读回显，不进入运行态”，并把 `D-04` 状态按实际收口（完成则 `done`，未完成则明确剩余缺口）。验证方式：三份文档对 `D-04`、`updateToVariant`、`webPort/webServiceWakeLock`、`EX-01=blocked` 的描述一致，无互相冲突。","verify_cmd":"rg -n \"D-04=|updateToVariant|webPort|webServiceWakeLock|只读回显|EX-01=blocked|in_progress|done\" docs/plans/2026-02-26-my-menu-id-diff.md docs/plans/2026-02-26-my-menu-parity-checklist.md docs/plans/evidence/2026-02-26-my-menu-final-regression/R-07-other-settings.md","required_paths":["docs/plans/2026-02-26-my-menu-id-diff.md","docs/plans/2026-02-26-my-menu-parity-checklist.md","docs/plans/evidence/2026-02-26-my-menu-final-regression/R-07-other-settings.md"],"depends_on":["C33-T1"]},{"id":"C33-T3","title":"完成 N-01/N-02 回归并回填证据","priority":3,"prompt":"改动范围：`lib/features/bookshelf/views/bookshelf_view.dart`、`lib/features/discovery/views/discovery_view.dart`、`docs/plans/evidence/2026-02-27-ui-nav-final-regression/R-N01-bookshelf.md`、`docs/plans/evidence/2026-02-27-ui-nav-final-regression/R-N02-discovery.md`。预期行为：按 `N-AC-01~N-AC-03` 对书架/发现执行手工回归；若发现大标题折叠、滚动驱动或根页返回手势异常，直接修复对应页面；两份证据回填“结果/处理动作/排版布局一致性”，移除“待验证/待回填”。验证方式：1) 两页保持 `useSliverNavigationBar: true`；2) 两份证据具备结果字段且无占位词。","verify_cmd":"rg -n \"useSliverNavigationBar:\\s*true\" lib/features/bookshelf/views/bookshelf_view.dart lib/features/discovery/views/discovery_view.dart && rg -n \"结果:|处理动作|排版布局一致性\" docs/plans/evidence/2026-02-27-ui-nav-final-regression/R-N01-bookshelf.md docs/plans/evidence/2026-02-27-ui-nav-final-regression/R-N02-discovery.md && ! rg -n \"待验证|待回填\" docs/plans/evidence/2026-02-27-ui-nav-final-regression/R-N01-bookshelf.md docs/plans/evidence/2026-02-27-ui-nav-final-regression/R-N02-discovery.md","required_paths":["lib/features/bookshelf/views/bookshelf_view.dart","lib/features/discovery/views/discovery_view.dart","docs/plans/evidence/2026-02-27-ui-nav-final-regression/R-N01-bookshelf.md","docs/plans/evidence/2026-02-27-ui-nav-final-regression/R-N02-discovery.md"],"depends_on":[]},{"id":"C33-T4","title":"完成 N-03/N-04 回归并回填证据","priority":4,"prompt":"改动范围：`lib/features/rss/views/rss_subscription_view.dart`、`lib/features/settings/views/settings_view.dart`、`docs/plans/evidence/2026-02-27-ui-nav-final-regression/R-N03-rss.md`、`docs/plans/evidence/2026-02-27-ui-nav-final-regression/R-N04-settings.md`。预期行为：按 `N-AC-01~N-AC-03` 对订阅/我的执行手工回归；若存在大标题折叠抖动、滚动容器不一致或侧滑返回异常，直接修复代码；两份证据回填真实结果。若未完全通过，按 AGENTS 1.1.2 在证据中补齐 `blocked` 四要素（原因/影响范围/替代方案/回补计划）。验证方式：1) 两页保持 `useSliverNavigationBar: true`；2) 两份证据无“待验证/待回填”，并含结果字段（或完整 blocked 记录）。","verify_cmd":"rg -n \"useSliverNavigationBar:\\s*true\" lib/features/rss/views/rss_subscription_view.dart lib/features/settings/views/settings_view.dart && rg -n \"结果:|处理动作|排版布局一致性|blocked|原因|影响范围|替代方案|回补计划\" docs/plans/evidence/2026-02-27-ui-nav-final-regression/R-N03-rss.md docs/plans/evidence/2026-02-27-ui-nav-final-regression/R-N04-settings.md && ! rg -n \"待验证|待回填\" docs/plans/evidence/2026-02-27-ui-nav-final-regression/R-N03-rss.md docs/plans/evidence/2026-02-27-ui-nav-final-regression/R-N04-settings.md","required_paths":["lib/features/rss/views/rss_subscription_view.dart","lib/features/settings/views/settings_view.dart","docs/plans/evidence/2026-02-27-ui-nav-final-regression/R-N03-rss.md","docs/plans/evidence/2026-02-27-ui-nav-final-regression/R-N04-settings.md"],"depends_on":[]},{"id":"C33-T5","title":"统一收口 N-VAL-01 与跨台账状态","priority":5,"prompt":"改动范围：`docs/plans/2026-02-27-ui-cupertino-diff.md`、`docs/plans/2026-02-26-my-menu-parity-checklist.md`、`PLANS.md`。预期行为：基于 R-N01~R-N04 的真实回归结果，统一更新 `N-01~N-04` 与 `N-VAL-01` 状态；全部通过则置 `done`，否则置 `blocked` 并引用四要素记录；同时同步 `D-04` 最新状态，清理 `pending/in_progress` 的过期悬空文案。验证方式：三份台账与四份证据状态一致，不再出现“待回填/待收口”矛盾。","verify_cmd":"rg -n \"D-04=|N-01~N-04|N-VAL-01|done|in_progress|pending|blocked|待回填|待收口\" docs/plans/2026-02-27-ui-cupertino-diff.md docs/plans/2026-02-26-my-menu-parity-checklist.md PLANS.md docs/plans/evidence/2026-02-27-ui-nav-final-regression/R-N01-bookshelf.md docs/plans/evidence/2026-02-27-ui-nav-final-regression/R-N02-discovery.md docs/plans/evidence/2026-02-27-ui-nav-final-regression/R-N03-rss.md docs/plans/evidence/2026-02-27-ui-nav-final-regression/R-N04-settings.md","required_paths":["docs/plans/2026-02-27-ui-cupertino-diff.md","docs/plans/2026-02-26-my-menu-parity-checklist.md","PLANS.md","docs/plans/evidence/2026-02-27-ui-nav-final-regression/R-N01-bookshelf.md","docs/plans/evidence/2026-02-27-ui-nav-final-regression/R-N02-discovery.md","docs/plans/evidence/2026-02-27-ui-nav-final-regression/R-N03-rss.md","docs/plans/evidence/2026-02-27-ui-nav-final-regression/R-N04-settings.md"],"depends_on":["C33-T2","C33-T3","C33-T4"]},{"id":"C33-T6","title":"补一轮定向一致性扫描并回填统计","priority":6,"prompt":"改动范围：`docs/plans/2026-02-27-ui-cupertino-diff.md`、`PLANS.md`。预期行为：执行定向检索并更新文档中的统计/结论，确保与当前代码一致：`shadcn_ui=0`、`showGeneralDialog=0`、`package:flutter/material.dart=0`、四核心页 `useSliverNavigationBar: true` 仍成立；将该扫描结果作为本轮收尾证据写入文档。验证方式：检索结果与文档统计一致，且无与当前代码冲突的旧数字。","verify_cmd":"rg -n \"shadcn_ui|showGeneralDialog|useSliverNavigationBar:\\s*true|CupertinoSliverNavigationBar|package:flutter/material.dart\" lib docs/plans/2026-02-27-ui-cupertino-diff.md PLANS.md","required_paths":["docs/plans/2026-02-27-ui-cupertino-diff.md","PLANS.md","lib/features/bookshelf/views/bookshelf_view.dart","lib/features/discovery/views/discovery_view.dart","lib/features/rss/views/rss_subscription_view.dart","lib/features/settings/views/settings_view.dart"],"depends_on":["C33-T5"]}],"notes":["上一轮 `rc=127` 且 `done.tsv` 为空，说明执行链路中断，不代表目标已完成。","当前最关键缺口是：Web 边界只读回显未落地、N 导航证据未回填、台账状态未统一收口。"]}